{
  "paper_id": "cli-demo-paper",
  "research_problem": "Automatically extract structured literature review signals from academic papers.",
  "problem_type": "information_extraction",
  "domain": "scholarly_nlp",
  "language_scope": "english",
  "method_summary": "A pipeline that combines retrieval, PDF parsing, chunking, and structured extraction.",
  "method_family": [
    "pipeline",
    "llm-assisted-extraction"
  ],
  "datasets": [],
  "tasks": [
    "literature_review",
    "information_extraction"
  ],
  "metrics": [],
  "baselines": [],
  "main_claims": [
    {
      "claim_id": "claim-1",
      "claim_text": "The pipeline can transform parsed paper chunks into a structured paper profile.",
      "claim_type": "methodological",
      "evidence_chunk_ids": [
        "1642aef6-9725-4a48-94ff-a815718d96db"
      ],
      "confidence": 0.7
    },
    {
      "claim_id": "claim-2",
      "claim_text": "The system supports downstream gap analysis by preserving evidence links.",
      "claim_type": "application",
      "evidence_chunk_ids": [
        "25cabe52-2a24-4448-aabc-a60e3168cecb"
      ],
      "confidence": 0.68
    }
  ],
  "limitations": [
    {
      "text": "The current output may rely on stubbed model behavior before real LLM integration.",
      "source": "inferred",
      "evidence_chunk_ids": [
        "1642aef6-9725-4a48-94ff-a815718d96db"
      ]
    }
  ],
  "future_work": [
    "Integrate real LLM provider",
    "Improve claim grounding"
  ],
  "notes": "Stub extraction response for local development."
}